{
  "$schema": "https://json-schema.org/draft/2020-12/schema",
  "$id": "https://scrollcase.dev/schema/v3/release-manifest.schema.json",
  "title": "Box release manifest",
  "description": "The immutable description of one built box: what it is, which target it runs on, where its archive lives, and how it was produced. Published as the payload of a signed document and never edited after signing; a correction ships as a new version.",
  "type": "object",
  "additionalProperties": false,
  "required": [
    "schemaVersion",
    "kind",
    "boxId",
    "version",
    "target",
    "compatibility",
    "archive",
    "runtime",
    "cacheSubdir",
    "selfTest",
    "provenance"
  ],
  "properties": {
    "schemaVersion": {
      "const": 3
    },
    "kind": {
      "$ref": "#/$defs/kind",
      "description": "Wire discriminator, \"<namespace>.release\". The namespace belongs to the publishing project \u2014 a project with boxes already in the field must keep emitting the one its clients recognise \u2014 and defaults to scrollcase.box for a new one."
    },
    "boxId": {
      "$ref": "#/$defs/identifier"
    },
    "labels": {
      "$ref": "#/$defs/labels"
    },
    "version": {
      "type": "string",
      "minLength": 1
    },
    "target": {
      "$ref": "https://scrollcase.dev/schema/v3/target.schema.json"
    },
    "compatibility": {
      "type": "object",
      "additionalProperties": true,
      "description": "What the host must satisfy before this box may be installed. The builder copies these constraints through verbatim and never interprets them, so a project may add its own alongside the ones defined here. A consumer that cannot evaluate a constraint must refuse the box rather than assume it passes.",
      "properties": {
        "minHostAppVersion": {
          "type": "string",
          "minLength": 1,
          "description": "Lowest version of the installing application this box supports."
        },
        "maxHostAppVersionExclusive": {
          "type": "string",
          "minLength": 1
        },
        "minMacosVersion": {
          "type": "string",
          "minLength": 1
        },
        "minRamGb": {
          "type": "number",
          "exclusiveMinimum": 0,
          "description": "Installed memory in decimal gigabytes (1 GB = 1,000,000,000 bytes)."
        },
        "minNvidiaDriverVersion": {
          "type": "string",
          "minLength": 1
        },
        "hostEnvironments": {
          "type": "array",
          "minItems": 1,
          "items": {
            "enum": [
              "native",
              "windows-wsl2"
            ]
          },
          "description": "Host environments this payload was validated on."
        }
      }
    },
    "archive": {
      "type": "object",
      "additionalProperties": false,
      "required": [
        "format",
        "sha256",
        "sizeBytes"
      ],
      "properties": {
        "format": {
          "const": "zip"
        },
        "url": {
          "type": "string",
          "minLength": 1,
          "description": "Where the archive is published, for the distribution layer that has to fetch it. Absent when the box was built without a publish base URL, which is what a box built to run locally is.\n\nNothing verifies this value and no Scrollcase consumer reads one: an archive is resolved beside its release document and identified by sha256, so a wrong URL here would break a download and no check at all. That is why an absent one is preferred to an invented one \u2014 a false address inside a signed, immutable document stays false forever."
        },
        "sha256": {
          "$ref": "#/$defs/sha256"
        },
        "sizeBytes": {
          "type": "integer",
          "exclusiveMinimum": 0
        }
      }
    },
    "installedSizeBytes": {
      "type": "integer",
      "exclusiveMinimum": 0,
      "description": "Sum of extracted payload file sizes before activation metadata is written, so a consumer can check free space before downloading."
    },
    "payloadDigest": {
      "type": "object",
      "additionalProperties": false,
      "required": [
        "format",
        "sha256"
      ],
      "description": "SHA-256 of the canonical entry list carried at payload-digest.v1 inside the payload, letting a consumer re-identify an extracted installation once the archive is gone. Optional: boxes built before it exists carry no such commitment.",
      "properties": {
        "format": {
          "const": "sha256-path-list-v1"
        },
        "sha256": {
          "$ref": "#/$defs/sha256"
        }
      }
    },
    "runtime": {
      "$ref": "#/$defs/runtime"
    },
    "cacheSubdir": {
      "type": "string",
      "minLength": 1,
      "description": "Directory relative to the extracted box root holding the box's own large files."
    },
    "bundledLicenses": {
      "$ref": "#/$defs/bundledLicenses"
    },
    "environment": {
      "type": "object",
      "description": "Signed environment variables applied whenever Scrollcase runs the box interpreter. These values override both the inherited host environment and caller-supplied values.",
      "propertyNames": {
        "minLength": 1,
        "pattern": "^[^=\\u0000]+$"
      },
      "additionalProperties": {
        "type": "string",
        "pattern": "^[^\\u0000]*$"
      }
    },
    "selfTest": {
      "$ref": "#/$defs/selfTest"
    },
    "execution": {
      "$ref": "https://scrollcase.dev/schema/v3/execution.schema.json"
    },
    "provenance": {
      "$ref": "#/$defs/provenance"
    },
    "assets": {
      "$ref": "#/$defs/deferredAssets"
    }
  },
  "$defs": {
    "identifier": {
      "type": "string",
      "pattern": "^[a-z0-9]+(?:[-.][a-z0-9]+)*$"
    },
    "runtime": {
      "type": "object",
      "additionalProperties": false,
      "required": [
        "id"
      ],
      "description": "What runs inside the box: the runtime, its version, and where its own executable sits in the payload. A consumer needs all three to run the box, and none of them are derivable from the target.",
      "properties": {
        "id": {
          "enum": [
            "python",
            "node",
            "native"
          ],
          "description": "The runtime the box carries. A consumer that does not recognise the id must refuse the box: the id decides the payload layout and the argv rule, so guessing would mean executing something on an assumption."
        },
        "version": {
          "type": "string",
          "minLength": 1,
          "description": "The runtime's own version. Absent for a runtime that has no interpreter to version."
        },
        "entryPoint": {
          "type": "string",
          "minLength": 1,
          "description": "The runtime's own executable relative to the extracted box root, for example venv/bin/python. Fixed per (runtime, target) by the runtime's layout. Absent for a runtime that has no separate executable to name."
        }
      }
    },
    "labels": {
      "type": "object",
      "description": "Free-form annotations the publishing project declared, signed and carried through untouched. Scrollcase attaches no meaning to any key; a consumer that reads one is reading its own project's convention, not the box format.",
      "propertyNames": {
        "$ref": "#/$defs/identifier"
      },
      "additionalProperties": {
        "type": "string",
        "minLength": 1
      }
    },
    "selfTest": {
      "type": "object",
      "additionalProperties": false,
      "required": [
        "probe",
        "timeoutSeconds"
      ],
      "description": "The check a consumer can repeat against an extracted box. The builder also ran the scroll's file assertions and any extra source it declared, which are builder-only: signing them would claim a consumer had reproduced a check it cannot see.",
      "properties": {
        "probe": {
          "$ref": "#/$defs/selfTestProbe"
        },
        "timeoutSeconds": {
          "type": "integer",
          "exclusiveMinimum": 0
        }
      }
    },
    "selfTestProbe": {
      "type": "object",
      "additionalProperties": false,
      "minProperties": 1,
      "description": "What the box proves about itself, in whichever shapes its runtime supports. The runtime turns this into command lines; nothing here is a command line, and nothing here is source in any language.",
      "properties": {
        "imports": {
          "type": "array",
          "minItems": 1,
          "description": "Modules the runtime must be able to load.",
          "items": {
            "type": "string",
            "minLength": 1
          }
        },
        "commands": {
          "type": "array",
          "minItems": 1,
          "description": "Invocations of the box's declared execution and the exit status each must produce.",
          "items": {
            "type": "object",
            "additionalProperties": false,
            "required": [
              "args",
              "expectExitCode"
            ],
            "properties": {
              "args": {
                "type": "array",
                "items": {
                  "type": "string"
                }
              },
              "expectExitCode": {
                "type": "integer",
                "minimum": 0,
                "maximum": 255
              }
            }
          }
        }
      }
    },
    "bundledLicenses": {
      "type": "array",
      "minItems": 1,
      "description": "Dependencies compiled inside the binaries this box ships, as the publishing project declared them. The conda environment's own licences are derived from pixi.lock and travel inside the payload; this list is the half no lock can see — code linked into a supplied executable before the build began — so it is declared, reviewed by the project, and signed here unchanged. It is carried in the release rather than only in the payload so that a licence decision can be made from the document alone, before an archive is downloaded. A box that declares none carries no such list, which means the project declared none and never that the box has no dependencies.",
      "items": {
        "type": "object",
        "additionalProperties": false,
        "required": [
          "name",
          "version",
          "declaredLicense",
          "linkedInto"
        ],
        "properties": {
          "name": {
            "type": "string",
            "minLength": 1,
            "description": "The dependency as its own project names it."
          },
          "version": {
            "type": "string",
            "minLength": 1
          },
          "declaredLicense": {
            "type": "string",
            "minLength": 1,
            "description": "The licence the project reviewed, conventionally an SPDX expression. Scrollcase carries the string through and never parses it: what a licence permits is not a question a packaging tool answers.",
            "examples": [
              "Apache-2.0 OR MIT"
            ]
          },
          "linkedInto": {
            "type": "array",
            "minItems": 1,
            "description": "Payload files this dependency is compiled into. Every path must be a file the built box actually carries, which is what makes the declaration checkable rather than a free-text notice.",
            "items": {
              "$ref": "#/$defs/payloadPath"
            }
          },
          "sourceUrl": {
            "type": "string",
            "minLength": 1,
            "description": "Where the dependency's source can be obtained, for a licence that requires the offer."
          }
        }
      }
    },
    "payloadPath": {
      "type": "string",
      "minLength": 1,
      "pattern": "^(?!/)(?![A-Za-z]:)(?!.*\\\\)(?!.*(?:^|/)\\.\\.(?:/|$))(?!.*//).+$",
      "description": "A forward-slash path inside the box payload: relative, non-empty, and unable to escape the payload root."
    },
    "deferredAssets": {
      "type": "array",
      "minItems": 1,
      "description": "Assets the consumer must fetch and place under the box root before first use — the entries the scroll declared with embed false, and only those. A box whose assets are all embedded carries no such list. The declared size and hash are what make fetching them safe; a Scrollcase consumer verifies them and never downloads them itself.",
      "items": {
        "type": "object",
        "additionalProperties": false,
        "required": [
          "url",
          "relativePath",
          "sizeBytes",
          "sha256"
        ],
        "properties": {
          "url": {
            "type": "string",
            "minLength": 1
          },
          "relativePath": {
            "type": "string",
            "minLength": 1
          },
          "sizeBytes": {
            "type": "integer",
            "exclusiveMinimum": 0
          },
          "sha256": {
            "$ref": "#/$defs/sha256"
          },
          "executable": {
            "type": "boolean",
            "description": "Present and true when the scroll declared the file executable. Whoever materializes it owns setting the bit: the file never passes through the archive, so nothing Scrollcase writes can carry a mode for it."
          }
        }
      }
    },
    "kind": {
      "type": "string",
      "pattern": "^[a-z0-9]+(?:[.-][a-z0-9]+)*\\.release$"
    },
    "sha256": {
      "type": "string",
      "pattern": "^[a-f0-9]{64}$"
    },
    "provenance": {
      "type": "object",
      "additionalProperties": false,
      "description": "How this box was produced. Every field is recorded by the builder from observed state, never accepted from caller input, so the record cannot be dressed up after the fact.",
      "required": [
        "scrollId",
        "scrollVersion",
        "builderRevision",
        "sourceTreeDirty",
        "sourceRevision",
        "dependencyLockSha256",
        "builtAt",
        "pixiVersion"
      ],
      "properties": {
        "scrollId": {
          "type": "string",
          "minLength": 1
        },
        "scrollVersion": {
          "type": "string",
          "minLength": 1
        },
        "builderRevision": {
          "type": "string",
          "pattern": "^[a-f0-9]{40}$",
          "description": "Exact commit of the builder source that produced the box."
        },
        "sourceTreeDirty": {
          "type": "boolean",
          "description": "Whether the builder's working tree carried uncommitted changes. True means the build is not reproducible from the recorded revision alone."
        },
        "sourceRevision": {
          "type": "string",
          "minLength": 1,
          "description": "Upstream revision of the packaged source, as declared by the scroll."
        },
        "runtimeVersion": {
          "type": "string",
          "minLength": 1,
          "description": "The runtime version the environment was solved with, repeated from runtime.version. Absent exactly when the runtime has none: provenance records what was observed and never invents a value to fill a field."
        },
        "pixiVersion": {
          "type": "string",
          "minLength": 1
        },
        "dependencyLockSha256": {
          "$ref": "#/$defs/sha256",
          "description": "Hash of the pixi.lock the environment was solved from."
        },
        "builtAt": {
          "type": "string",
          "minLength": 1
        }
      }
    }
  }
}
